experiment_id	condition_id	item_id	text	question	response_true	response_distractors
negation	neg_NP	1	"Die Tante erzählt, dass es gestern einen Sturm gab. Das Haus hat keinen Schaden, sagt die Tante zur Tochter. Der Gartenzaun ist umgefaffel, fügt sie noch hinzu."	Muss das Haus repariert werden?	NEIN	JA
negation	neg_VP	2	"Die Tochter erzählt, dass Emir und die anderen Schüler auf den Bus warten müssen. Emir ist nicht geduldig, sagt die Tochte zur Mutter. Er spielt auf seinem Handy, während er wartet, fügt die Tochter noch hinzu." 	Wartet Emir gerne?	NEIN	JA
negation	aff_trans	3	"Der Opa erzählt, dass Nehir und Selma jetzt Geigenstunden nehmen. Nehir hat eine Begabung, sagt der Opa zu Oma. Die beiden üben jeden Mittwoch in der Musikschule, fügt er noch hinzu."	Ist Nehir musikalisch?	JA	NEIN
negation	aff_intrans	4	"Die Mutter hat erzählt, dass vor der Haustür ein Paket liegt. Das Paket ist beschriftet, sagt die Mutter zum Vater. Es ist sehr schwer, fügt sie noch hinzu."	Liegt vor der Haustür ein beschriftetes Paket?	JA	NEIN
wortstellung	d-p	1	"Die Mutter hat erzählt, dass Peter den Onkel getroffen hat. Den hat er zum Grillen eingeladen, sagt die Mutter zum Vater. Sie wollen Spareribs machen, fügt sie noch hinzu."	Hat Peter den Onkel zum Grillen eingeladen?	JA	NEIN